EmailId,Sent,Subject,Sender,AnomalyType,AnomalyName
401,17/01/2017 02:30:57,Nisi dolorem ipsa delectus illo incidunt voluptatem.,orpha.medhurst@tremblayhamill.org,3,Matter attachment to non-corporate domain
402,16/01/2017 22:16:47,Qui odio autem quaerat voluptas harum est harum ut.,santiago.white@tremblayhamill.org,3,Matter attachment to non-corporate domain
403,17/01/2017 19:38:02,Earum id dolores.,santiago.white@tremblayhamill.org,3,Matter attachment to non-corporate domain
404,19/01/2017 19:57:16,A minus error libero vitae eaque minima explicabo.,santiago.white@tremblayhamill.org,3,Matter attachment to non-corporate domain
405,16/01/2017 06:12:20,Cumque ut commodi eaque aut eveniet.,araceli.bode@tremblayhamill.org,3,Matter attachment to non-corporate domain
406,17/01/2017 02:10:52,Ipsam et fuga quae.,orpha.medhurst@tremblayhamill.org,3,Matter attachment to non-corporate domain
407,15/01/2017 20:28:23,Qui laboriosam adipisci.,josh.walsh@tremblayhamill.org,3,Matter attachment to non-corporate domain
408,19/01/2017 19:28:57,Exercitationem eveniet fuga.,nedra.pfeffer@tremblayhamill.org,3,Matter attachment to non-corporate domain
409,19/01/2017 18:34:27,Voluptas iusto et omnis blanditiis minus molestiae eos sunt eos.,soledad.rolfson@tremblayhamill.org,3,Matter attachment to non-corporate domain
410,15/01/2017 05:06:36,Laborum molestias totam iste.,nedra.pfeffer@tremblayhamill.org,3,Matter attachment to non-corporate domain
411,19/01/2017 22:15:00,Et voluptatem ut sed suscipit esse minima.,luigi.hahn@tremblayhamill.org,3,Matter attachment to non-corporate domain
412,16/01/2017 19:28:23,Consequatur repudiandae aut itaque et consequatur dolorem quas non ut.,josh.walsh@tremblayhamill.org,3,Matter attachment to non-corporate domain
413,16/01/2017 04:57:39,Non eligendi et.,santiago.white@tremblayhamill.org,3,Matter attachment to non-corporate domain
414,18/01/2017 12:01:41,Officia id amet et et aperiam molestias.,soledad.rolfson@tremblayhamill.org,3,Matter attachment to non-corporate domain
415,15/01/2017 01:31:52,Non tenetur aut quis aut saepe ut dolor reprehenderit.,nedra.pfeffer@tremblayhamill.org,3,Matter attachment to non-corporate domain
416,18/01/2017 22:19:49,Non eum possimus ut repellendus modi repellat impedit.,santiago.white@tremblayhamill.org,3,Matter attachment to non-corporate domain
417,19/01/2017 05:50:24,Quo officia voluptas aut ut.,orpha.medhurst@tremblayhamill.org,3,Matter attachment to non-corporate domain
418,15/01/2017 17:28:42,Veniam qui ad aut.,nedra.pfeffer@tremblayhamill.org,3,Matter attachment to non-corporate domain
419,16/01/2017 08:24:35,Sed vel numquam qui quas tempora quasi nobis.,nedra.pfeffer@tremblayhamill.org,3,Matter attachment to non-corporate domain
420,15/01/2017 04:47:20,Non adipisci nam dignissimos qui voluptate voluptatem commodi doloribus.,soledad.rolfson@tremblayhamill.org,3,Matter attachment to non-corporate domain
421,17/01/2017 18:09:26,Sit et tenetur.,brain.nienow@tremblayhamill.org,3,Matter attachment to non-corporate domain
422,19/01/2017 13:50:21,Dolores dolor in non et veritatis eius molestias.,uriah.schoen@tremblayhamill.org,3,Matter attachment to non-corporate domain
423,16/01/2017 15:07:46,Qui labore quidem.,soledad.rolfson@tremblayhamill.org,3,Matter attachment to non-corporate domain
424,16/01/2017 07:36:21,Quae assumenda harum aliquam.,santiago.white@tremblayhamill.org,3,Matter attachment to non-corporate domain
425,16/01/2017 00:06:46,Aperiam veniam unde.,araceli.bode@tremblayhamill.org,3,Matter attachment to non-corporate domain
426,17/01/2017 15:12:47,Repudiandae cumque ut dolorem vero voluptas repudiandae similique voluptas.,luigi.hahn@tremblayhamill.org,3,Matter attachment to non-corporate domain
427,17/01/2017 14:26:29,Corporis quis architecto et.,brain.nienow@tremblayhamill.org,3,Matter attachment to non-corporate domain
428,15/01/2017 01:35:25,Sit eveniet ad.,santiago.white@tremblayhamill.org,3,Matter attachment to non-corporate domain
429,19/01/2017 00:23:12,Voluptatem quia animi reiciendis est hic laborum incidunt quaerat.,soledad.rolfson@tremblayhamill.org,3,Matter attachment to non-corporate domain
430,17/01/2017 12:47:24,Labore quis odit assumenda consectetur placeat expedita iste voluptatem quis.,luigi.hahn@tremblayhamill.org,3,Matter attachment to non-corporate domain
431,19/01/2017 01:48:23,Est in nam a pariatur et sed.,uriah.schoen@tremblayhamill.org,3,Matter attachment to non-corporate domain
432,16/01/2017 05:10:57,Et in qui impedit exercitationem odit laboriosam sed quod.,luigi.hahn@tremblayhamill.org,3,Matter attachment to non-corporate domain
433,16/01/2017 06:37:22,Facere minus cum recusandae totam facilis non laboriosam.,santiago.white@tremblayhamill.org,3,Matter attachment to non-corporate domain
434,15/01/2017 01:21:00,Aut dolore vitae ut totam.,uriah.schoen@tremblayhamill.org,3,Matter attachment to non-corporate domain
435,17/01/2017 01:35:27,Quo ut modi veritatis.,josh.walsh@tremblayhamill.org,3,Matter attachment to non-corporate domain
436,15/01/2017 16:27:33,Est voluptatem voluptatem eum qui itaque sint.,soledad.rolfson@tremblayhamill.org,3,Matter attachment to non-corporate domain
437,18/01/2017 16:25:43,Nostrum porro modi quaerat.,brain.nienow@tremblayhamill.org,3,Matter attachment to non-corporate domain
438,16/01/2017 23:39:00,Ut nulla nulla at eum.,nedra.pfeffer@tremblayhamill.org,3,Matter attachment to non-corporate domain
439,16/01/2017 17:15:03,Eum molestiae molestias molestias repellat beatae.,santiago.white@tremblayhamill.org,3,Matter attachment to non-corporate domain
440,15/01/2017 04:32:43,At culpa exercitationem tenetur eum ut.,nedra.pfeffer@tremblayhamill.org,3,Matter attachment to non-corporate domain
441,17/01/2017 11:26:26,Non dicta voluptatem.,luigi.hahn@tremblayhamill.org,3,Matter attachment to non-corporate domain
442,19/01/2017 05:13:40,Officia labore omnis mollitia sequi aut tempore dolorum.,orpha.medhurst@tremblayhamill.org,3,Matter attachment to non-corporate domain
443,19/01/2017 11:35:49,Voluptatum assumenda rerum dolorum dolorem quis eos iste ab expedita.,uriah.schoen@tremblayhamill.org,3,Matter attachment to non-corporate domain
444,18/01/2017 03:44:27,Aut voluptatibus dolorum voluptas praesentium autem nihil recusandae est debitis.,soledad.rolfson@tremblayhamill.org,3,Matter attachment to non-corporate domain
445,19/01/2017 08:29:25,Voluptatum in ipsum fugiat accusantium molestiae.,brain.nienow@tremblayhamill.org,3,Matter attachment to non-corporate domain
446,17/01/2017 00:06:10,Et doloribus nihil sit ratione dignissimos.,araceli.bode@tremblayhamill.org,3,Matter attachment to non-corporate domain
447,16/01/2017 02:31:29,Porro ut aliquam et fuga.,brain.nienow@tremblayhamill.org,3,Matter attachment to non-corporate domain
448,15/01/2017 18:58:40,Dolores libero rerum.,uriah.schoen@tremblayhamill.org,3,Matter attachment to non-corporate domain
449,18/01/2017 14:34:11,Rerum veritatis est minus.,brain.nienow@tremblayhamill.org,3,Matter attachment to non-corporate domain
450,15/01/2017 16:26:05,Eveniet consequatur cupiditate aut enim modi sed ut numquam quis.,orpha.medhurst@tremblayhamill.org,3,Matter attachment to non-corporate domain
451,15/01/2017 17:00:19,Facere corrupti accusamus molestiae officiis.,uriah.schoen@tremblayhamill.org,3,Matter attachment to non-corporate domain
452,18/01/2017 03:24:47,Laudantium quia fugiat maiores quia.,brain.nienow@tremblayhamill.org,3,Matter attachment to non-corporate domain
453,16/01/2017 19:27:04,Harum voluptatem tenetur eveniet dolor quo numquam omnis eos.,araceli.bode@tremblayhamill.org,3,Matter attachment to non-corporate domain
454,18/01/2017 15:00:10,Laborum nihil cumque ut quis voluptatem.,araceli.bode@tremblayhamill.org,3,Matter attachment to non-corporate domain
455,15/01/2017 09:38:04,Sit repellendus quia aliquam et commodi dolores fuga.,brain.nienow@tremblayhamill.org,3,Matter attachment to non-corporate domain
456,15/01/2017 06:00:47,Quae enim nostrum excepturi eum neque.,santiago.white@tremblayhamill.org,3,Matter attachment to non-corporate domain
457,15/01/2017 07:31:18,Ratione quas ad velit.,josh.walsh@tremblayhamill.org,3,Matter attachment to non-corporate domain
458,18/01/2017 12:57:27,Eaque aut consequuntur sit.,nedra.pfeffer@tremblayhamill.org,3,Matter attachment to non-corporate domain
459,18/01/2017 23:28:59,Ut consequatur omnis rerum non aut.,araceli.bode@tremblayhamill.org,3,Matter attachment to non-corporate domain
460,17/01/2017 15:11:03,Sed tenetur molestiae veritatis voluptas voluptate aspernatur velit officia.,orpha.medhurst@tremblayhamill.org,3,Matter attachment to non-corporate domain
461,19/01/2017 01:30:45,Voluptatem nostrum similique rerum eum aliquid ipsum.,brain.nienow@tremblayhamill.org,3,Matter attachment to non-corporate domain
462,17/01/2017 14:20:30,Sed maxime vel facilis non eligendi deleniti.,brain.nienow@tremblayhamill.org,3,Matter attachment to non-corporate domain
463,16/01/2017 15:30:54,Quasi ipsum est possimus illo.,luigi.hahn@tremblayhamill.org,3,Matter attachment to non-corporate domain
464,16/01/2017 10:36:20,Asperiores perferendis ea delectus consequatur iure dolorum perferendis.,shawna.grady@tremblayhamill.org,3,Matter attachment to non-corporate domain
465,16/01/2017 07:43:32,Cumque accusamus soluta.,luigi.hahn@tremblayhamill.org,3,Matter attachment to non-corporate domain
466,16/01/2017 21:31:02,Delectus consequuntur ex vel aut.,araceli.bode@tremblayhamill.org,3,Matter attachment to non-corporate domain
467,16/01/2017 07:34:30,Repellendus ut sed eum aperiam.,shawna.grady@tremblayhamill.org,3,Matter attachment to non-corporate domain
468,16/01/2017 21:17:20,Molestiae nesciunt placeat ducimus nostrum id ex.,soledad.rolfson@tremblayhamill.org,3,Matter attachment to non-corporate domain
469,16/01/2017 19:03:41,Architecto rerum laborum nesciunt aut sequi consequatur rerum.,orpha.medhurst@tremblayhamill.org,3,Matter attachment to non-corporate domain
470,18/01/2017 04:38:36,Qui molestiae qui architecto itaque.,nedra.pfeffer@tremblayhamill.org,3,Matter attachment to non-corporate domain
471,19/01/2017 15:18:40,Atque voluptates quo excepturi necessitatibus aut sit voluptatem.,orpha.medhurst@tremblayhamill.org,3,Matter attachment to non-corporate domain
472,19/01/2017 01:28:16,Libero error dolor est natus quisquam est asperiores.,santiago.white@tremblayhamill.org,3,Matter attachment to non-corporate domain
473,15/01/2017 12:23:21,Laboriosam id hic deleniti.,araceli.bode@tremblayhamill.org,3,Matter attachment to non-corporate domain
474,15/01/2017 12:01:24,Minus sed vel sed et.,luigi.hahn@tremblayhamill.org,3,Matter attachment to non-corporate domain
475,18/01/2017 19:44:51,Cum expedita aut consequatur excepturi.,josh.walsh@tremblayhamill.org,3,Matter attachment to non-corporate domain
476,15/01/2017 01:42:05,Eos est quia a omnis occaecati repellat.,nedra.pfeffer@tremblayhamill.org,3,Matter attachment to non-corporate domain
477,16/01/2017 11:12:54,Nemo praesentium velit.,luigi.hahn@tremblayhamill.org,3,Matter attachment to non-corporate domain
478,18/01/2017 21:32:48,Voluptas ea quo illo explicabo qui repudiandae facilis laboriosam.,araceli.bode@tremblayhamill.org,3,Matter attachment to non-corporate domain
479,16/01/2017 09:37:36,Eos unde veniam quaerat.,nedra.pfeffer@tremblayhamill.org,3,Matter attachment to non-corporate domain
480,16/01/2017 04:54:35,Doloremque tempora voluptatem velit sequi in.,uriah.schoen@tremblayhamill.org,3,Matter attachment to non-corporate domain
481,15/01/2017 09:16:00,Nihil saepe culpa eaque incidunt dolorum modi itaque quos.,luigi.hahn@tremblayhamill.org,3,Matter attachment to non-corporate domain
482,17/01/2017 11:30:11,Et harum nihil sed fugit.,josh.walsh@tremblayhamill.org,3,Matter attachment to non-corporate domain
483,16/01/2017 18:29:21,Impedit laborum amet rerum veniam corporis non voluptates.,soledad.rolfson@tremblayhamill.org,3,Matter attachment to non-corporate domain
484,19/01/2017 11:01:59,Dolorem corporis voluptates et reiciendis.,nedra.pfeffer@tremblayhamill.org,3,Matter attachment to non-corporate domain
485,16/01/2017 14:07:08,Rerum tenetur culpa porro quis sit.,brain.nienow@tremblayhamill.org,3,Matter attachment to non-corporate domain
486,18/01/2017 08:20:47,Nesciunt ducimus reprehenderit iure enim quia id quo molestias est.,nedra.pfeffer@tremblayhamill.org,3,Matter attachment to non-corporate domain
487,18/01/2017 20:14:34,Magnam recusandae dolore mollitia accusamus.,nedra.pfeffer@tremblayhamill.org,3,Matter attachment to non-corporate domain
488,16/01/2017 08:44:31,Ut delectus reiciendis pariatur aut.,araceli.bode@tremblayhamill.org,3,Matter attachment to non-corporate domain
489,19/01/2017 10:02:38,Qui architecto voluptatibus vero ut ea.,brain.nienow@tremblayhamill.org,3,Matter attachment to non-corporate domain
490,18/01/2017 14:06:19,Alias modi et ipsum facere velit dolor sunt officiis perspiciatis.,brain.nienow@tremblayhamill.org,3,Matter attachment to non-corporate domain
491,17/01/2017 12:12:36,Ut repellendus laboriosam vitae et iusto.,josh.walsh@tremblayhamill.org,3,Matter attachment to non-corporate domain
492,18/01/2017 14:17:50,Repellat excepturi repellendus sed praesentium omnis eius laboriosam ut.,nedra.pfeffer@tremblayhamill.org,3,Matter attachment to non-corporate domain
493,19/01/2017 14:08:06,Optio facere ad aut.,shawna.grady@tremblayhamill.org,3,Matter attachment to non-corporate domain
494,15/01/2017 14:36:43,Beatae ut quia et illo velit officia beatae aut et.,uriah.schoen@tremblayhamill.org,3,Matter attachment to non-corporate domain
495,17/01/2017 01:46:30,Amet alias praesentium asperiores quis.,nedra.pfeffer@tremblayhamill.org,3,Matter attachment to non-corporate domain
496,17/01/2017 13:20:23,Voluptatem ratione ullam voluptas ut dolorem.,soledad.rolfson@tremblayhamill.org,3,Matter attachment to non-corporate domain
497,16/01/2017 18:31:05,Placeat maiores ratione optio occaecati corporis omnis.,santiago.white@tremblayhamill.org,3,Matter attachment to non-corporate domain
498,15/01/2017 19:47:26,Sit unde autem.,orpha.medhurst@tremblayhamill.org,3,Matter attachment to non-corporate domain
499,15/01/2017 03:30:07,Adipisci iste est et dolorum nam quibusdam eligendi hic dicta.,brain.nienow@tremblayhamill.org,3,Matter attachment to non-corporate domain
500,16/01/2017 12:08:32,Amet sunt dignissimos maiores consequatur.,luigi.hahn@tremblayhamill.org,3,Matter attachment to non-corporate domain
